{
  "$schema": "https://forge-h2.local/schemas/verified-citations.schema.json",
  "project_id": "FHZ-ENTERPRISE-001",
  "version": "1.0.0",
  "purpose": "법령·기술기준의 서지사항(코드번호·명칭·판번호·개정일)을 온라인에서 확인한 기록이다. 원문 확보가 아니다.",
  "policy": [
    "이 파일은 서지 확인 기록이며 Evidence 가 아니다. 어떤 항목도 그 자체로 Gate 근거가 되지 않는다.",
    "baseline_eligible 은 local_artifact 와 sha256 이 모두 있을 때만 true 가 될 수 있다. 현재 전건 false 다.",
    "조문 내용·적용 범위·적합성 판정은 이 파일에 기록하지 않는다. 자격자가 원문으로 판단한다.",
    "knowledge/offline-source-register.json 의 deny_all_remote_fetch 는 에이전트 런타임 정책이며 이 파일이 그것을 바꾸지 않는다."
  ],
  "verification_channel": {
    "tool": "WebSearch / WebFetch",
    "shell_network": "blocked_by_sandbox",
    "artifact_download": "partially_available",
    "notes": [
      "정정 (2026-09-23). 앞서 '원문 바이트를 받을 수 없다'고 기록했으나 틀렸다. WebFetch 는 바이너리 응답을 로컬 파일로 저장하며, h2hub 첨부 경로에서 1.2MB PDF 를 받아 sha256 을 산출했다. 다만 cyber.kgs.or.kr 은 HTTP 400 을 반환해 받을 수 없고, 받은 PDF 도 본문 추출에 실패해 내용은 확인하지 못했다.",
      "HTTP 400 — 세 가지 경로(코드 PDF, introduce 페이지, 슬래시 제거)에서 모두 실패",
      "PDF 본문 추출은 pypdf 설치 후 성공했다. 앞서 'CID 인코딩이라 추출 불가'라고 한 것은 라이브러리 부재 때문이었다."
    ]
  },
  "citations": [
    {
      "citation_id": "CIT-ISO-14687",
      "kind": "international_standard",
      "identifier": "ISO 14687",
      "title_verified": "Hydrogen fuel quality — Product specification",
      "current_edition": "ISO 14687:2025 (2nd edition)",
      "superseded_edition": "ISO 14687:2019 (withdrawn)",
      "effective_date": "2025-02 (월까지만 확인, 일자 미확인)",
      "statutory_basis": null,
      "url": "https://www.iso.org/standard/82660.html",
      "retrieved_at": "2026-09-23",
      "verification_method": "WebSearch — iso.org 카탈로그 페이지 제목. 페이지 직접 fetch 는 하지 않았다",
      "verified": [
        "표준 존재",
        "현행판 번호",
        "구판 폐지 여부"
      ],
      "not_verified": [
        "조문 내용",
        "불순물 한계값",
        "시행일 일자",
        "본 프로젝트 적용 여부"
      ],
      "relates_to": [
        "DR-10",
        "M-033 specify_hydrogen_quality",
        "H2QualitySpec",
        "Purity"
      ],
      "local_artifact": null,
      "sha256": null,
      "baseline_eligible": false
    },
    {
      "citation_id": "CIT-KGS-AH371",
      "kind": "kr_technical_code",
      "identifier": "KGS AH371",
      "title_verified": "고정형 연료전지 제조의 시설·기술·검사 기준 (Facility/Technical/Inspection Code for Manufacture of Gas Fuel Cells)",
      "current_edition": "KGS AH371 2025",
      "superseded_edition": "KGS AH371 2024 ('24.7.23. 개정) 및 그 이전 11개 판",
      "effective_date": "2025-12-09",
      "statutory_basis": "「수소경제 육성 및 수소 안전관리에 관한 법률」 제48조제1항에 따라 「고압가스 안전관리법」 제33조의2 가스기술기준위원회 심의·의결(2025.11.21)을 거쳐 기후에너지환경부 승인(2025.12.9)",
      "url": "https://h2hub.or.kr/main/info/regulation_info.do?mode=view&articleNo=3035",
      "retrieved_at": "2026-09-23",
      "verification_method": "현행판 원문 PDF 79쪽을 pypdf 로 추출해 표제지·제개정이력·적용범위를 직접 확인",
      "verified": [
        "코드번호 KGS AH371 2025",
        "기준 명칭(국문·영문)",
        "제정 2021.7.5 이후 개정 12회",
        "최종 개정 2025.12.9 (기후에너지환경부 승인)",
        "심의·의결 2025.11.21",
        "적용범위 1.1.1 (현행판)",
        "총 79쪽"
      ],
      "not_verified": [
        "본 프로젝트 규모에 적용되는 코드가 무엇인지",
        "조문 전체의 내용상 정합성"
      ],
      "relates_to": [
        "소용량 고정형 연료전지에 한정",
        "본 프로젝트 비적용",
        "M-062 map_kgs_codes",
        "M-068 screen_psm_applicability"
      ],
      "local_artifact": null,
      "sha256": null,
      "baseline_eligible": false,
      "artifact_candidate": {
        "url": "https://h2hub.or.kr/main/info/regulation_info.do?mode=download&articleNo=3035&attachNo=5963",
        "retrieved_at": "2026-09-23",
        "media_type": "application/pdf",
        "bytes": 1357628,
        "sha256": "889a96add8f19feb1362c035d56f7ed23cec71a4ca2ff475bce826a41f2811cd",
        "pdf_version": "1.4",
        "pdf_creator": "Hwp 2022 12.0.0.3437",
        "pdf_producer": "Hancom PDF 1.3.0.547",
        "pdf_creation_date": "2024-07-22T09:25:53+09:00",
        "authentication_required": false,
        "content_verified": true,
        "content_verification_attempt": "pypdf 로 79쪽 전체 추출. 표제지 'KGS AH371 2025' 확인.",
        "provenance_support": [
          "h2hub 규제개선 정보 게시물 제목이 '고정형 연료전지 제조의 시설·기술·검사 기준(KGS AH371)('24.7.23. 개정)' 이다",
          "PDF 생성일 2024-07-22 가 개정일 2024-07-23 의 하루 전으로 정합적이다"
        ],
        "import_status": "rejected",
        "import_blocker": "재배포 조건 불충족. h2hub 저작권 정책은 공공누리 표시가 부착된 자료만 자유이용을 허용하고, 그 외 자료는 무단 복제·배포·개작을 금지한다. 이 PDF 에는 공공누리 표시가 없고 저작권자도 H2KOREA 가 아니라 가스기술기준위원회·한국가스안전공사 계열로 보인다. 저장소에 커밋하지 않는다. 필요하면 발행처에서 직접 반입하고 이용허락을 확인한다.",
        "local_path_outside_repo": "tool-results/webfetch-1790130405354-bm2bvn.pdf",
        "pages": 79,
        "pdf_mod_date": "unknown"
      },
      "scope_verified": {
        "clause": "1.1.1",
        "text": "「수소경제 육성 및 수소 안전관리에 관한 법률 시행규칙」 제2조제3항제1호가목에 따른 연료소비량이 232.6 ㎾(20만 ㎉/h) 이하인 고정형 연료전지와 그 부대설비",
        "upper_bound_fuel_input_kw": 232.6,
        "note": "2024판과 2025판의 적용범위 1.1.1 문언이 동일하다. 두 판을 각각 추출해 대조했다. 상한은 본문 표(버너 안전차단시간·자동제어 허용조건)에서도 '120 초과 232.6 이하'로 일관된다."
      },
      "applicability_to_project": {
        "verdict": "not_applicable",
        "basis": "본 프로젝트는 총발전단 20 MW 이고 app/calc.py 실행값 기준 연료투입 42,105 kW 다. AH371 적용 상한 232.6 kW 의 약 181배다. 2024판·2025판 모두 상한이 같으므로 판 변경과 무관하게 비적용이다.",
        "confidence": "high — 적용범위 조문과 프로젝트 규모 모두 문서로 확인됨",
        "caution": "적용 코드가 무엇인지는 확인하지 않았다. 추측하지 않는다. 발전용 대용량 연료전지에 적용되는 기준은 자격자가 관할과 함께 확정한다."
      },
      "note": "h2hub 게시물은 2025.12.09 개정의 승인 공고번호를 '산업통상부 공고 제2025-077호' 로 표기하나, 원문 제개정 이력에서 제2025-077호는 2025.11.28 개정이고 2025.12.9 개정은 기후에너지환경부 승인이다. 포털 메타데이터와 원문이 어긋난다. 원문을 따른다."
    },
    {
      "citation_id": "CIT-KGS-AH171",
      "kind": "kr_technical_code",
      "identifier": "KGS AH171",
      "title_verified": "수소추출설비 제조의 시설·기술·검사 기준",
      "current_edition": "'24.7.23. 개정",
      "superseded_edition": null,
      "effective_date": "2024-07-23",
      "statutory_basis": null,
      "url": "https://h2hub.or.kr/main/info/regulation_info.do?mode=view&articleNo=2185",
      "retrieved_at": "2026-09-23",
      "verification_method": "WebFetch — 수소경제 종합정보포털 규제개선 정보 페이지 직접 조회",
      "verified": [
        "코드번호",
        "기준 명칭",
        "개정일"
      ],
      "not_verified": [
        "제정일",
        "근거 법령",
        "조문 내용",
        "본 프로젝트 적용 여부"
      ],
      "relates_to": [
        "수소추출설비 채택 시 적용 후보",
        "M-031 select_supply_path"
      ],
      "local_artifact": null,
      "sha256": null,
      "baseline_eligible": false
    },
    {
      "citation_id": "CIT-KGS-FU671",
      "kind": "kr_technical_code",
      "identifier": "KGS FU671",
      "title_verified": "수소연료사용시설의 시설·기술·검사 기준",
      "current_edition": null,
      "superseded_edition": null,
      "effective_date": null,
      "statutory_basis": null,
      "url": "https://cyber.kgs.or.kr/kgscode.Kgscode01introduce.ex.do/",
      "retrieved_at": "2026-09-23",
      "verification_method": "WebSearch 결과에 경로가 노출됨. 직접 접근은 HTTP 400 으로 실패",
      "verified": [
        "코드번호와 명칭이 존재한다는 것"
      ],
      "not_verified": [
        "현행 판번호",
        "개정일",
        "조문 내용",
        "적용 범위"
      ],
      "relates_to": [
        "수소연료사용시설 — 본 프로젝트 해당 가능성 높음",
        "M-062 map_kgs_codes"
      ],
      "local_artifact": null,
      "sha256": null,
      "baseline_eligible": false,
      "note": "정정 (2026-09-23). cyber.kgs.or.kr 의 공개 PDF 경로는 WebFetch 에서 HTTP 400 이다. 검색 결과에 노출된 URL 에는 세션 경로 파라미터가 붙어 있어 직접 접근이 되지 않는다. 다만 같은 계열 문서를 h2hub 첨부 경로로는 받을 수 있었다(CIT-KGS-AH371 참조). FU671 의 h2hub 게시물은 찾지 않았다."
    },
    {
      "citation_id": "CIT-KGS-FU111",
      "kind": "kr_technical_code",
      "identifier": "KGS FU111",
      "title_verified": "고압가스 저장의 시설ㆍ기술ㆍ검사ㆍ안전성평가 기준",
      "current_edition": "2026.06.12 개정",
      "superseded_edition": null,
      "effective_date": "2026-06-12",
      "statutory_basis": null,
      "url": "https://h2hub.or.kr/main/info/regulation_info.do?mode=view&articleNo=3122",
      "retrieved_at": "2026-09-23",
      "verification_method": "h2hub 규제개선 정보 목록에서 제목·개정일 확인. 원문 미확보, 적용범위 조문 미확인",
      "verified": [
        "코드번호",
        "기준 명칭",
        "개정일"
      ],
      "not_verified": [
        "적용범위 조문",
        "본 프로젝트 적용 여부",
        "근거 법령",
        "조문 내용"
      ],
      "relates_to": [
        "M-062 map_kgs_codes",
        "20 MW 연료전지 발전소 적용 후보",
        "200 bar 수소 저장설비 — 적용 가능성 높음"
      ],
      "local_artifact": null,
      "sha256": null,
      "baseline_eligible": false,
      "applicability_to_project": {
        "verdict": "undetermined",
        "basis": "적용범위 조문을 확인하지 않았다. 후보로만 등록한다.",
        "caution": "추측으로 확정하지 않는다. 원문 1.1 적용범위를 대조한 뒤 자격자가 관할과 함께 판정한다."
      }
    },
    {
      "citation_id": "CIT-KGS-FP111",
      "kind": "kr_technical_code",
      "identifier": "KGS FP111",
      "title_verified": "고압가스 특정제조의 시설ㆍ기술ㆍ검사ㆍ감리ㆍ정밀안전검진 기준",
      "current_edition": "2026.06.08 개정",
      "superseded_edition": null,
      "effective_date": "2026-06-08",
      "statutory_basis": null,
      "url": "https://h2hub.or.kr/main/info/regulation_info.do?mode=view&articleNo=3126",
      "retrieved_at": "2026-09-23",
      "verification_method": "h2hub 규제개선 정보 목록에서 제목·개정일 확인. 원문 미확보, 적용범위 조문 미확인",
      "verified": [
        "코드번호",
        "기준 명칭",
        "개정일"
      ],
      "not_verified": [
        "적용범위 조문",
        "본 프로젝트 적용 여부",
        "근거 법령",
        "조문 내용"
      ],
      "relates_to": [
        "M-062 map_kgs_codes",
        "20 MW 연료전지 발전소 적용 후보",
        "대규모 제조시설 해당 여부 확인 필요"
      ],
      "local_artifact": null,
      "sha256": null,
      "baseline_eligible": false,
      "applicability_to_project": {
        "verdict": "undetermined",
        "basis": "적용범위 조문을 확인하지 않았다. 후보로만 등록한다.",
        "caution": "추측으로 확정하지 않는다. 원문 1.1 적용범위를 대조한 뒤 자격자가 관할과 함께 판정한다."
      }
    },
    {
      "citation_id": "CIT-KGS-FP112",
      "kind": "kr_technical_code",
      "identifier": "KGS FP112",
      "title_verified": "고압가스 일반제조의 시설ㆍ기술ㆍ검사ㆍ감리ㆍ안전성평가 기준",